{
  "id": "event.water_tariff",
  "schemaVersion": 1,
  "name": "Industrial Water Tariff",
  "description": "The regulator prices industrial withdrawal to reflect scarcity. Evaporative cooling gets expensive.",
  "eventClass": "political",
  "trigger": {
    "dailyProbability": 0.0007,
    "minimumYear": 1995,
    "cooldownDays": 1095
  },
  "durationDays": 1825,
  "durationVarianceDays": 0,
  "effects": [
    {
      "target": "water.priceMultiplier",
      "operation": "multiply",
      "value": 1.8,
      "priority": 20
    }
  ],
  "immediateCash": 0,
  "immediateTrust": 1,
  "immediateReputation": 0,
  "mitigation": "Reclaimed supply and closed-loop reuse blunt most of the increase."
}
