{
  "id": "event.transformer_shortage",
  "schemaVersion": 1,
  "name": "Transformer Shortage",
  "description": "Global demand for grid-scale transformers outruns supply. Lead times on electrical plant double.",
  "eventClass": "operational",
  "trigger": {
    "dailyProbability": 0.0009,
    "minimumYear": 1995,
    "cooldownDays": 365
  },
  "durationDays": 240,
  "durationVarianceDays": 90,
  "effects": [
    {
      "target": "facility.constructionSpeed",
      "operation": "multiply",
      "value": 0.62,
      "priority": 20
    },
    {
      "target": "power.capex",
      "operation": "multiply",
      "value": 1.3,
      "priority": 20
    }
  ],
  "immediateCash": 0,
  "immediateTrust": 0,
  "immediateReputation": 0,
  "mitigation": "Order long-lead electrical plant early, or stage expansion behind the equipment you already hold."
}
